P_ID,ProductName,Category,PricePerUnit,Description
1,Skin Baker,Bakery,1.34,Especially north might benefit sense.
2,Out Vegetable,Vegetables,17.34,Audience power own sign believe let nice prepare.
3,May Dair,Dairy,12.61,Game chance body reveal.
4,Test Beverage,Beverages,3.19,Fill similar add many.
5,Left Fruit,Fruits,19.94,Nation while with.
6,Two Vegetable,Vegetables,5.41,Itself TV like gas economic use expect.
7,Guess Beverage,Beverages,5.72,Just true which option.
8,Full Vegetable,Vegetables,14.26,Skin fear population theory adult mouth between among.
9,Far Fruit,Fruits,15.34,Computer attorney probably may back concern.
10,Practice Beverage,Beverages,14.9,Such all mean.
11,Air Dair,Dairy,10.51,Current set least fast sit wind music perform.
12,Agent Vegetable,Vegetables,4.08,Table authority pattern clear yeah own Mrs.
13,Consider Vegetable,Vegetables,10.05,Money office quality.
14,Real Mea,Meat,13.77,Not society lose mission far.
15,Once Vegetable,Vegetables,5.31,Decision herself drive man increase.
16,Stop Dair,Dairy,6.17,Throughout those finish along analysis.
17,Already Beverage,Beverages,8.84,It involve all product finish much.
18,Cause Vegetable,Vegetables,8.66,Stand chair everybody fine cover.
19,Build Vegetable,Vegetables,6.04,Range security full have feeling appear.
20,Culture Vegetable,Vegetables,6.75,Heart subject soldier upon.
1,Develop Fruit,Fruits,46.52,Social show like themselves bed.
2,Strong Fruit,Fruits,47.07,Television ball only art argue field.
3,Soldier Mea,Meat,33.8,Nice fill environmental art better give state.
4,Save Vegetable,Vegetables,15.16,Bag sense fact number spring certain.
5,While Dair,Dairy,32.85,Between together goal smile science notice everything.
6,Value Beverage,Beverages,32.47,Some eight speech final son just car.
7,Member Vegetable,Vegetables,9.12,Wide either similar performance city officer carry.
8,Possible Mea,Meat,27.38,Reduce fire finish.
9,Discussion Dair,Dairy,20.36,Certain once little also.
10,Natural Fruit,Fruits,34.11,Painting various second artist computer.
11,Which Vegetable,Vegetables,1.89,West together lawyer similar short employee movie.
12,Treatment Mea,Meat,7.15,Seat several property education under significant.
13,Small Dair,Dairy,29.11,Idea new around avoid stuff high while current.
14,Pretty Beverage,Beverages,19.25,Write our happy four issue.
15,Field Dair,Dairy,43.6,Fill good now oil arrive high key may.
16,Step Vegetable,Vegetables,43.17,Identify structure accept actually find hospital.
17,Ever Dair,Dairy,8.3,Half entire production fight.
18,Answer Dair,Dairy,43.9,Blue attention social lose certainly face book.
19,Account Dair,Dairy,13.84,Control describe way instead stop pass after appear.
20,Least Fruit,Fruits,11.97,Realize democratic mean.
21,Social Mea,Meat,38.65,Skill guess total station view oil.
22,Another Dair,Dairy,21.3,Sort seat top administration choose.
23,Me Mea,Meat,20.71,Less just firm view report scene.
24,Maintain Fruit,Fruits,35.86,Industry thought use.
25,Include Vegetable,Vegetables,36.1,Business food level evening culture step show.
26,Water Baker,Bakery,18.42,Thank example anything house partner most.
27,Wind Fruit,Fruits,29.38,Stand behind money true sister so.
28,View Vegetable,Vegetables,43.58,Hear unit last.
29,Above Fruit,Fruits,20.07,Easy trip participant person story sound.
30,Against Beverage,Beverages,40.36,Edge shake what six blood rule.
31,Article Dair,Dairy,35.53,Population everything size trouble important.
32,Teach Mea,Meat,16.87,Group listen fast evidence give contain front continue.
33,Change Beverage,Beverages,42.38,Show form individual smile lawyer.
34,But Dair,Dairy,20.8,Ask fear mention art.
35,Movement Vegetable,Vegetables,45.13,If commercial with southern actually rise.
36,Position Dair,Dairy,2.06,Season drop big let price beautiful certain.
37,Adult Beverage,Beverages,26.06,Sea rule wrong hold happy model.
38,Scene Baker,Bakery,3.99,Else as many want probably gun.
39,Radio Fruit,Fruits,9.71,Everything local gun toward.
40,Next Fruit,Fruits,48.2,Book professor market role foot he catch.
41,Project Baker,Bakery,1.79,Job recognize less stand story appear Congress item.
42,Research Baker,Bakery,20.23,Place upon large bill these player.
43,Develop Beverage,Beverages,27.52,Only boy land ok really rock skill.
44,Watch Beverage,Beverages,41.49,Goal manager fear.
45,Knowledge Fruit,Fruits,6.27,Race north approach then born popular enjoy.
46,Receive Dair,Dairy,28.47,Me executive check every.
47,Fish Beverage,Beverages,12.74,Article travel middle most.
48,Now Dair,Dairy,10.08,Forget free bed far.
49,It Fruit,Fruits,24.53,Respond my peace affect.
50,Difficult Mea,Meat,16.57,Minute next movie third all military specific.
51,Establish Beverage,Beverages,1.86,Girl impact herself environmental hold.
52,Grow Fruit,Fruits,44.36,While heart direction building.
53,Eye Beverage,Beverages,30.59,Management space among people south his recent.
54,Capital Vegetable,Vegetables,5.72,Kitchen same near skin than.
55,Develop Vegetable,Vegetables,12.6,Thought source several church tell.
56,Firm Vegetable,Vegetables,19.68,Dark measure choice fact throw avoid professional.
57,Position Fruit,Fruits,37.31,Which family cup remain use region with.
58,Writer Beverage,Beverages,2.59,Week can difference increase offer member million.
59,Hand Mea,Meat,28.05,Off surface pretty every term lose.
60,Particular Vegetable,Vegetables,5.79,Determine entire include agency of give.
61,Scene Fruit,Fruits,18.59,Adult woman wind set with.
62,Somebody Beverage,Beverages,28.57,Store toward company perform quickly rich market.
63,Yes Dair,Dairy,28.73,Often treat any four simple reality choice.
64,Energy Vegetable,Vegetables,21.44,Itself officer few either.
65,Hope Fruit,Fruits,8.02,Local lot gun concern I finally computer.
66,Cold Beverage,Beverages,42.73,Quickly shoulder weight sort.
67,Order Fruit,Fruits,28.35,Home success southern animal final hospital.
68,Stay Beverage,Beverages,23.73,Value administration simply letter.
69,Guy Dair,Dairy,47.61,Central agency catch buy language she live.
70,Itself Dair,Dairy,11.33,Plant nation develop.
71,Wind Baker,Bakery,15.36,Room gun nearly high.
72,Generation Beverage,Beverages,42.03,Economic though down economy as.
73,Language Beverage,Beverages,43.45,Doctor yard group blood make time there.
74,At Mea,Meat,34.03,You picture vote certainly.
75,Avoid Dair,Dairy,37.33,Significant yet drive official shoulder shake.
76,Side Fruit,Fruits,16.44,Ten me window out specific tend account.
77,Beyond Fruit,Fruits,45.53,Police national such happy stage friend.
78,Section Dair,Dairy,13.99,Send picture age gas vote charge.
79,Despite Baker,Bakery,5.55,Ahead test new where start buy administration.
80,Instead Mea,Meat,12.07,Rich southern six chance product continue deal.
81,Some Beverage,Beverages,41.87,Arrive effort free.
82,Woman Vegetable,Vegetables,36.54,Though again computer meeting start there budget street.
83,Send Vegetable,Vegetables,46.38,World fish trouble chance whatever.
84,Minute Dair,Dairy,2.88,Explain religious purpose right.
85,Party Fruit,Fruits,14.43,Factor between artist table during.
86,Hope Mea,Meat,34.68,Mouth worker candidate foot different grow public.
87,Clear Baker,Bakery,28.65,National yard culture money development myself know.
88,Decide Beverage,Beverages,45.27,Somebody piece us forget rest before opportunity.
89,Decision Mea,Meat,16.59,Just trade able outside according.
90,Evidence Mea,Meat,16.37,Who wall room art happen.
91,This Baker,Bakery,29.14,Name seek good about.
92,Stuff Vegetable,Vegetables,13.5,Same find speak.
93,Possible Beverage,Beverages,48.93,Product certain civil receive.
94,Moment Fruit,Fruits,49.66,Ever seat firm four.
95,So Fruit,Fruits,8.55,Field he option organization south.
96,Politics Dair,Dairy,11.23,Task bag year wish.
97,Pm Fruit,Fruits,4.11,Six consider once law various.
98,Assume Fruit,Fruits,4.09,Serious seek political half not shake animal.
99,Build Mea,Meat,11.68,Say play age Congress.
100,Lead Baker,Bakery,3.34,Rest by term gun family involve to.
